[
  {
    "userId": "0198559a-826b-70a5-ac45-a204f33f1220",
    "measurementType": "heart-rate-intraday",
    "measurementDateTime": "2025-09-13T00:00:00.000000Z",
    "measurementValue": {
      "activities-heart": [
        {
          "dateTime": "2019-05-08",
          "value": {
            "customHeartRateZones": [
              {
                "caloriesOut": 1164.09312,
                "max": 90,
                "min": 30,
                "minutes": 718,
                "name": "Below"
              },
              {
                "caloriesOut": 203.65344,
                "max": 110,
                "min": 90,
                "minutes": 74,
                "name": "Custom Zone"
              },
              {
                "caloriesOut": 330.76224,
                "max": 220,
                "min": 110,
                "minutes": 42,
                "name": "Above"
              }
            ],
            "heartRateZones": [
              {
                "caloriesOut": 979.43616,
                "max": 86,
                "min": 30,
                "minutes": 626,
                "name": "Out of Range"
              },
              {
                "caloriesOut": 514.16208,
                "max": 121,
                "min": 86,
                "minutes": 185,
                "name": "Fat Burn"
              },
              {
                "caloriesOut": 197.92656,
                "max": 147,
                "min": 121,
                "minutes": 18,
                "name": "Cardio"
              },
              {
                "caloriesOut": 6.984,
                "max": 220,
                "min": 147,
                "minutes": 5,
                "name": "Peak"
              }
            ],
            "restingHeartRate": 76
          }
        }
      ],
      "activities-heart-intraday": {
        "dataset": [
          {
            "time": "00:00:00",
            "value": 78
          },
          {
            "time": "00:01:00",
            "value": 78
          },
          {
            "time": "00:02:00",
            "value": 77
          },
          {
            "time": "00:03:00",
            "value": 77
          },
          {
            "time": "00:04:00",
            "value": 77
          }
        ],
        "datasetInterval": 1,
        "datasetType": "minute"
      }
    }
  }
]